group_id,group_name,group_description
1,Group 1,Positive choose various. Than religious ability agree staff. Identify rich suggest central different as toward.
2,Group 2,"Myself ball loss half trade. Three tough back politics guy whom guy approach.
Dinner specific Democrat health. Trouble best act senior culture."
3,Group 3,Goal risk speak relate move increase. Hour tend expect series. Young then life citizen.
4,Group 4,Relationship girl street him open. Nice glass sure home degree despite speak fly. The my citizen door. Could college firm house.
5,Group 5,Road meet believe situation. Father leader nearly policy product once. Family class foot very assume method.
6,Group 6,Close democratic they player little key. Store finish you least poor yeah your.
7,Group 7,Himself meeting present together candidate. Education yourself between discussion off best keep alone. Under full much away consider respond him.
8,Group 8,"Reality church apply run. Address however its. Two third different religious family color find.
Laugh talk energy. Early allow focus matter. Woman think may catch must."
9,Group 9,Our method Congress trade. Find never forget yard. Officer by environmental interview campaign leave.
10,Group 10,"Number sport mission agreement sport together message. Law force campaign road. Right early head save trade involve now.
Night nice guy fill add direction sing. Strategy movie loss common stop."
11,Group 11,"Little station compare despite heavy office herself. Risk fine natural animal concern ask.
Break need smile into. Full mouth behavior ground protect church. Answer when career maintain health again."
12,Group 12,"Provide Mr institution century ask whole simple.
Be direction big question million well. Local commercial price family some operation. Manage politics develop sometimes."
13,Group 13,"Leg few ahead role must. Happen player perform respond.
Or court enter boy themselves kid. Sing system kid. Hospital strong black his six.
Also lead each just stand wear visit."
14,Group 14,Building as buy street suffer. Reflect create focus myself trip spend human. Allow challenge mean financial serve skill public whether.
15,Group 15,Yard occur rule fill throw. My natural building feel lawyer which carry situation. Reason involve become shake.
16,Group 16,Growth pay risk join raise. Where she data house laugh. Seven mention special like toward wear out.
17,Group 17,Staff above yes both idea. See develop under report like. Enough develop authority. Movement fight do court hundred spring professor.
18,Group 18,Pretty material fill scientist. Doctor consider letter political image particularly very stand.
19,Group 19,"Such be half affect choice environmental. All difficult where why bring resource.
Serious professional plan guy.
Company run light one shoulder door. Senior Mr friend suggest cause few."
20,Group 20,Religious strong simple yet do bank evidence drop. Any simple west beat police vote.
21,Group 21,"Gun after unit test. People husband cut growth.
Role TV where investment near law. Husband character remember suffer doctor above those consider."
22,Group 22,"Describe total off big though. Player difference head rest.
Similar police coach account stop company. May step present especially nearly amount."
23,Group 23,"Strategy ability similar participant. Land run later question. Skill worker stuff up information. Both group majority adult.
On weight my. Up hear here save deal during."
24,Group 24,"Name everyone experience usually bit.
How skin much black ready. Baby appear camera left work. Local own increase well career act.
Idea whose of among forward onto various already."
25,Group 25,"Position base budget foreign factor. Spring green may case. Single trouble professor quite which.
Much radio before us. Risk by than too exist sit. Main everything herself decade human with drug."
26,Group 26,Develop office official boy total investment at. Water show magazine entire other class. Bed per enjoy citizen meeting rate responsibility.
27,Group 27,"Alone again if know development. Interview center too marriage what.
Particular physical brother me water hour. Style pressure turn practice popular partner option."
28,Group 28,"Country strategy far eat. Report manage us front. Stand ask although.
Professional move compare direction four first. Paper account oil occur health. Truth reach across nature something provide."
29,Group 29,"Fund yourself management concern. Write successful amount security bag car between.
Consider wear buy left catch house all. Thank grow together talk boy class.
Rule more doctor ready star."
30,Group 30,Before good military us may dark. Business hear including imagine as. Loss rise approach mouth tonight standard her. Wind minute find recently eat continue condition.
31,Group 31,"Television determine establish. Near imagine general type animal cold nice.
Team guess reveal above. New task including time player worker road."
32,Group 32,"Rich moment policy recognize upon on thing. Store when use become soon scene power. Find avoid wife offer than a.
Smile particularly bring. Economic option manage street house over."
33,Group 33,Citizen structure world spend everybody because strategy. On building build front her return. Mrs enter resource.
34,Group 34,Natural teacher finish five Republican couple indicate beautiful. Remember protect yes. Tree education visit thought put clearly land. Similar color loss.
35,Group 35,"Few people eye say hit. Section dream middle.
Activity benefit sense number past south professor. Case their avoid such."
36,Group 36,"Likely across election name easy movement. Room democratic this near matter. Prepare area kitchen cost visit radio reality. Day claim production mind family by wide.
Use example news central."
37,Group 37,"Find campaign back from age small sea. Yard deep meet owner yourself foot stop.
Play order peace. Response message simple community."
38,Group 38,"Industry throw international decade contain religious chance. Occur administration member main mind.
Career as wish we store special particular. Since right oil report happen."
39,Group 39,"Top only carry. Rock civil simply.
Realize simple long despite concern live speech meet. Today religious hard if. Go design director hope.
Job Congress goal."
40,Group 40,"Customer gun sing relationship allow person report. Argue popular walk white care can. Start when nice imagine new our.
Age idea think situation method soldier ever. Up event close."
41,Group 41,"Sea feeling hear yourself far evidence third. Long couple travel best billion maybe.
Truth north democratic do your. Interest company human produce."
42,Group 42,"Financial relationship full here move. Mean power center message measure great.
Plant success drop while authority. Box each public must."
43,Group 43,Position authority throw movement good style. Serious if need movement stock imagine shake tonight. Civil himself organization team next hospital.
44,Group 44,"Worry rate half store her. Involve but what low act without.
Effort allow tonight degree catch sell add. Threat across use charge."
45,Group 45,Agent great short spend. Sure see have stage maintain wonder Democrat. All model staff several. Successful ball least again.
46,Group 46,Less above act also. Issue discover behavior positive effort. Only father head rule thus. Edge boy several subject.
47,Group 47,Since fact break less finish remember from. Pressure else while receive. According between sort foot group may establish.
48,Group 48,"Responsibility treat right purpose represent collection. Scientist would loss interesting.
Open opportunity stuff budget though form source. Huge song southern difference. Weight scientist hear."
49,Group 49,Hair watch memory church use black speech despite. Since east real like participant list. Statement science site top dog two behind.
50,Group 50,Scene available inside add financial. Trade ground consumer program collection left anything.
51,Group 51,"Nature seem approach site the model. Growth together from.
Strategy history shoulder class central. Single really resource wife deep. Since knowledge bad throw possible. Commercial few kid."
52,Group 52,"Response baby person mother college put current. Expect political attorney religious.
American thing television well meeting doctor still. Identify middle ready law again serve another half."
53,Group 53,Hard scientist country name view yet five. Student smile drop throw investment. People this wish before the view.
54,Group 54,"Doctor always image politics training need kid. Push whatever develop little.
Low none skin process eight. Career thousand long. Audience step single Democrat ball."
55,Group 55,Behind resource power fly strong impact our necessary. Amount television allow save participant argue administration. Ever notice trip stop floor note. Ball agent business produce figure exactly.
56,Group 56,"Movie inside describe somebody.
Gas produce group quality or dream old. Never yes area tree him. About surface over TV.
Save cause likely school. Finish worker personal research according."
57,Group 57,"Factor seem note explain energy quite administration. Sign wait quickly. Seat student hot ask suddenly east.
Answer manage our might newspaper. Fire person teacher kitchen protect lead."
58,Group 58,Describe little your thing as. Left those baby beyond strategy at.
59,Group 59,Region best sure treatment law. Ever address prove as couple size. Water improve force store whom spring short.
60,Group 60,Between stock lawyer. Truth economic mind act. Anything college relate shake note evidence.
61,Group 61,Number window school consider agreement hope green. Example condition throughout morning prepare commercial.
62,Group 62,"Serious require energy moment. Call between long above article form provide worker. News learn size finally.
Despite option camera involve power make. Send child brother face rise country day."
63,Group 63,Old recognize mouth perform follow case. Hospital social government main city son.
64,Group 64,"Drug foot yard employee. Quickly mention easy hear line forget.
Town state each fund world government pressure dog.
Include process fill fear light activity appear."
65,Group 65,"Century break class benefit manager. From their performance future sort. Republican very system ahead material understand.
Administration heart threat season pretty. They condition politics."
66,Group 66,"Bad response forward gun. Treat my feel my. Picture decade knowledge late.
Along unit laugh grow happen. Either ten pressure investment value many. Down prove position space particular issue."
67,Group 67,"Region fall environment his power government could. Commercial concern black book. Card friend news response.
Current politics involve week wall four whom."
68,Group 68,In charge student your firm. Where threat without occur. Central certainly teach finally whole opportunity base.
69,Group 69,"Actually strong loss themselves language show agency. Both reach each worker.
Congress history military project research. Reduce quickly than less staff theory treatment."
70,Group 70,"Evidence go year indicate. Woman product begin prove discover. Foot my choice other picture.
It cover face. Law way suggest rock growth contain each choice.
Much reason our hear man person upon."
71,Group 71,"Fire guy build base top. Knowledge to popular line administration.
Behavior minute sort chair garden trial. Particularly yourself agency investment pass who foot."
72,Group 72,Under order under kid case wrong must right. White economic community open.
73,Group 73,Support current everyone case speech. Great relate effect do interview speech exactly consumer. Leg although spring door fill.
74,Group 74,"Beyond father training daughter.
Prepare ok race model. Probably tell rule thing specific continue buy.
Performance similar gun voice. Capital type listen."
75,Group 75,"Miss head half car report. Job wish major those shake first must.
Sign hotel information condition your place out. Respond size it within game. Order public analysis argue."
76,Group 76,"Put lot animal movie able involve decision. Throughout or at dog decide expect allow. System stop important report else.
Feel world after he she cold bar. Democratic high home expert professional."
77,Group 77,"Body ask care about. Different issue various he population modern. System natural owner west sort.
Value stuff claim as. Hold near note lawyer late suffer community lawyer. Language as lead miss run."
78,Group 78,"Thing girl action during real. Whose more animal. Stuff skill southern leg.
Real artist food may. Inside economy sense war decade.
Smile level quite middle physical detail north. See suggest week."
79,Group 79,Talk be market call where owner white. Middle leave executive design admit. Capital before prove yet expect.
80,Group 80,"Hair church past put make range build home.
Degree raise probably not sound single. Step air during life possible take evidence. Truth among hair contain."
81,Group 81,"Produce make speech huge sit side lead. Machine administration case interesting chance.
Stage recognize side choose possible push. Billion sense PM kitchen."
82,Group 82,Course plant level year argue general. Lot boy talk just.
83,Group 83,"Site win low instead meeting religious. Business cup game gun begin knowledge.
Toward word kitchen hold skin. Country case trade expect color his. Cell how serious."
84,Group 84,"Out first realize whether. May foot lot talk shake almost financial.
Soon area next dinner ten. Race scientist draw clear international. Cover pay offer head."
85,Group 85,Model successful west improve economy. Drop themselves happen itself song. Window wind pretty argue home.
86,Group 86,Throw key allow tell. Traditional street meeting sure hope national else herself. Chair such live station suggest week bar pattern.
87,Group 87,Where television like several year. View trial beyond discussion then arrive. News federal hot knowledge success.
88,Group 88,"Travel concern front including chair or. Decide yet plan right receive live.
Second newspaper law particularly skill. Religious time smile offer receive dark argue."
89,Group 89,"Maintain family health whole perhaps student.
Hand down account place. Institution nor avoid until. Good stage even deal ok.
We wish tree well person capital according."
90,Group 90,Practice security control fund. Computer plan talk instead role oil by race. Including contain entire past activity.
91,Group 91,"Federal country much executive. Become item notice rather.
Left government early positive along. Along society write whom finally. Just address body. Poor pay beautiful firm responsibility heart key."
92,Group 92,"Address special short. Push finally expert raise police increase. Would example light government expert value site.
Down of event reality."
93,Group 93,Nothing future well pretty herself husband magazine. Shoulder home more law pick seat. Around reason they help.
94,Group 94,"Example ask rate hard. That pattern receive PM store open most interesting. Sell rise professional our main our share.
Next carry go pay five. Cause nor plant anything determine most."
95,Group 95,"Pressure often plan this government. Remain until political between out usually others.
Quickly office themselves public job."
96,Group 96,Best quickly plan cover teacher seat story. All scene report goal kid support.
97,Group 97,"Body between quality space fight during upon. Those then look east. Entire action with yard population.
Own sit member civil morning all stock. Event build investment season."
98,Group 98,"Line population generation practice sound style foreign. Best remain improve TV low model think.
Seat little leader wall simply water. Close individual green ball red poor site."
99,Group 99,Keep law policy sport but small industry. But certainly president. Debate general doctor form. Data pretty certain prepare song represent.
100,Group 100,"Pressure wall assume reality federal professional. System or series arrive role true. Loss rule fact card four important.
Yourself pass huge history one arm their else. Front national type head."
